{
  "schemaVersion": 1,
  "generator": "agent-governance-starter",
  "profile": "macos",
  "agent": "codex",
  "requiredDocuments": [
    "PROJECT_BRIEF.md",
    "SPEC.md",
    "CONTEXT.md",
    "TASK_CONTRACT.md",
    "OPEN_LOOPS.md",
    "AGENTS.md",
    "TECH_STACK.md"
  ],
  "includedDocuments": [
    "PROJECT_BRIEF.md",
    "SPEC.md",
    "CONTEXT.md",
    "TASK_CONTRACT.md",
    "OPEN_LOOPS.md",
    "AGENTS.md",
    "TECH_STACK.md",
    "MACOS_RELEASE_CHECKLIST.md",
    "TESTER_HANDOFF.md"
  ]
}
