{
  "schemaVersion": 1,
  "generator": "agent-governance-starter",
  "profile": "fullstack-ai",
  "agent": "codex",
  "requiredDocuments": [
    "README.md",
    "PROJECT_BRIEF.md",
    "SPEC.md",
    "CONTEXT.md",
    "TASK_CONTRACT.md",
    "OPEN_LOOPS.md",
    "AGENTS.md",
    "TECH_STACK.md",
    "DATA_MODEL.md",
    "API_CONTRACT.md",
    "ENV_CHECKLIST.md",
    "AI_SECURITY_REVIEW.md"
  ],
  "includedDocuments": [
    "README.md",
    "PROJECT_BRIEF.md",
    "SPEC.md",
    "CONTEXT.md",
    "TASK_CONTRACT.md",
    "OPEN_LOOPS.md",
    "AGENTS.md",
    "TECH_STACK.md",
    "DATA_MODEL.md",
    "API_CONTRACT.md",
    "ENV_CHECKLIST.md",
    "AGENT_RUNTIME.md",
    "RAG_DESIGN.md",
    "EVAL_PLAN.md",
    "AI_SECURITY_REVIEW.md"
  ]
}
